Autor,Titulo,Descrição,Conteudo,Contagem Palavra Tesla,Contagem Palavra Elon Mushen,Contagem Palavra Carro
semafor.com,Tesla unveils ‘Cybercab’ robotaxi in bid to diversify business,"The News
Tesla on Friday unveiled Cybercab, its self-driving robotaxi, as the electric carmaker hopes to diversify its business amid stagnating EV sales, with plans to build a network of autonomous cabs to compete with ride-hailing giant Uber.
The Cybercab wi…","
        The NewsTesla on Friday unveiled Cybercab, its self-driving robotaxi, as the electric carmaker hopes to diversify its business amid stagnating EV sales, with plans to build a network of autonomous cabs to compete with ride-hailing giant Uber.The Cybercab will have no steering wheel or…
    ",1,0,1
Sean Burch,Elon Musk Is Prepared to Spend at Least $140 Million to Help Elect Donald Trump,"The New York Times says the X and Tesla boss is ""obsessive, almost manic"" about the former president beating Kamala Harris 
The post Elon Musk Is Prepared to Spend at Least $140 Million to Help Elect Donald Trump appeared first on TheWrap.","The New York Times says the X and Tesla boss is “obsessive, almost manic” about the former president beating Kamala Harris  Tesla boss Elon Musk is spending big to help Donald Trump get back in the White House.  The New York Times on Friday reported Musk’s pro-Trump super PAC, dubbed the America PAC, has “spent about $80 million” so far this campaign. But that figure may soon be updated to show anywhere between $140 million and $180 million spent on helping the Republican candidate. Here’s the key section from the NYT story: “The scale of Mr. Musk’s personal financial commitment will not be made public until the middle of [October]. Initially, Mr. Musk and his friends in the group had spoken of a budget totaling from $140 million to $180 million, almost all it from Mr. Musk himself. The group has told other prospective donors in recent weeks that it is fully funded.” Musk has been open about his support for the former president in recent months. He publicly endorsed Trump after his first assassination attempt in Butler, Pennsylvania, in July. Since then, he’s posted on X in favor of Trump, hosted a live conversation with him on X Spaces in August and joined the reality TV show host-turned-politician on stage when he returned to Butler last weekend. “President Trump must win to preserve the Constitution,” Musk said at Trump’s rally last week. “He must win to preserve democracy in America.”  The Times, in its Friday story, called Musk’s support of Trump “obsessive, almost manic.”  America PAC’s website, which includes a picture of Musk in his “dark MAGA” hat, lists a handful of top priorities, including free speech, safe cities and secure borders. The PAC is focused on knocking on doors in battleground states like Pennsylvania and Wisconsin, with a goal of getting 800,000 to 1 million citizens to vote for Trump. Vice President Kamala Harris, meanwhile, has a number of big-name billionaires backing her, including Netflix co-founder Reed Hastings, former Facebook COO Sheryl Sandberg and LinkedIn co-founder Reid Hoffman.  Harris has raised $1 billion in less than three months since replacing President Joe Biden as the Democratic nominee.  Your email address will not be published. Required fields are marked * Comment *  Name *  Email *  Website   Save my name, email, and website in this browser for the next time I comment.  

  Δ This site uses Akismet to reduce spam. Learn how your comment data is processed.",2,1,0
Laura Bratton,Tesla stock sinks as ‘toothless’ robotaxi disappoints,Tesla stock sank after its robotaxi debut disappointed investors.,"Tesla (TSLA) stock sank more than 7% Friday midday as investors signaled disappointment over the EV maker’s robotaxi debut. Following the event on Thursday night, “We, Robot” — which aimed to cement CEO Elon Musk’s position as an AI leader — investors and analysts came away with more skepticism than excitement over Tesla’s lofty vision for a future of driverless cabs. Jefferies (JEF) analysts called Tesla’s $30,000 robotaxi, dubbed the Cybercab, a “toothless taxi” in a note to investors Friday morning, adding that Tesla has “ambitious targets"" with “little evidence of feasibility.” “We believe TSLA potentially underappreciates the obstacles to scaling a robotaxi fleet,” they wrote. Tesla’s new Cybercab has no steering wheel or pedals and is designed to be fully autonomous, Yahoo Finance’s Pras Subramanian reported. The company said it will begin unsupervised full self-driving (FSD) trials with Model 3 and Model Y test vehicles next year in Texas and California. Tesla is aiming to begin Cybercab production “before 2027,” Musk said. Tesla’s stock drop on Friday extended a two-week decline. TSLA shares fell last week after the company missed Wall Street estimates on its third quarter deliveries, issued a recall, and discontinued a lower-priced model. The stock — which has experienced far more volatility over the past year than its Magnificent Seven peers — is down 17% from last year. Still, TSLA’s Friday price of $220 per share is far higher than lows below $140 this spring. Shares hit a 15-month low in April amid Tesla’s layoffs and price cuts. Investors and analysts had hoped the company’s long-awaited robotaxi event would live up to the hype but were disappointed by Musk’s lack of clarity over how the company would achieve its ambitious goals. Raymond James (RJF) analyst Josh Beck called Tesla’s plan to commercialize its Cybercabs “vague” and “underwhelming.” Morgan Stanley (MS) analysts said the event included a “disappointing lack of detail” about updates to Tesla's FSD technology and market strategy. RBC Capital analyst Tom Narayan concurred, writing in a note Friday that investors believe Musk’s vision “was light of real numbers and timelines.” “These typically come at Tesla events,” he added. “This one seemed focused on branding and marketing Tesla's vision, rather than giving concrete numbers for us to model out.” Additionally, Tesla did not reveal details about a lower-priced vehicle as some investors had hoped. That vehicle is expected to launch in the first half of 2025, analysts noted. To be sure, some experts on Wall Street think “We, Robot” was a success. Bank of America analysts said the robotaxi event “lived up to the hype.” Wedbush analyst and Tesla bull Dan Ives said in a note Friday, “We believe last night was a glimpse of the future of Tesla and next generation transportation for consumers.” He also noted the presence of Tesla’s humanoid robot Optimus, which was “well ahead” of Wedbush expectations. Musk said Optimus could be ""[the] biggest product ever of any kind"" in terms of commercial success, Bank of America (BAC) analysts noted. The AI tech underlying the robot is the same as that used in Tesla’s vehicles. “We think this speaks to the fact that at this point TSLA is more than a traditional automotive company,” Bank of America analysts said. While noting the lack of details on Tesla’s Cybercab rollout, Wedbush’s Ives said, “[W]e strongly disagree with the notion that last night was a disappointment as we would argue the opposite seeing Cybercab with our own eyes and the massive improvements in Optimus which we interacted with throughout the evening.” The overall muted reaction to Tesla’s robotaxi launch is a good sign for ride-hailing companies Uber (UBER) and Lyft (LYFT). “Clearly building and launching a service is the longer-term direction for Tesla but the vagueness around the service (or clarity in not saying it) may reduce fears that UBER and LYFT would have to start defending share as soon as next — which was our primary fear coming in,” RBC's Narayan said. Uber and Lyft shares both jumped around 10% Friday. Wall Street has mixed opinions on Tesla stock. Some 26 of Wall Street analysts tracked by Bloomberg recommend buying it, while 20 have a Hold rating and 15 advise investors to sell it. Overall, analysts see shares falling to $216.59 over the next 12 months, according to Bloomberg consensus data. Laura Bratton is a reporter for Yahoo Finance. Follow her on X @LauraBratton5. Click here for the latest stock market news and in-depth analysis, including events that move stocks Read the latest financial and business news from Yahoo Finance Sign in to access your portfolio",21,1,0
Fred Lambert,Elon Musk wants you to believe Tesla is about to deliver self-driving without any data,"There was one big thing missing from Tesla’s autonomy event yesterday: data. Elon Musk wants you to believe Tesla is about to deliver self-driving, but you just have to believe him despite the fact that he has been wrong about it every year for the past five …","There was one big thing missing from Tesla’s autonomy event yesterday: data. Elon Musk wants you to believe Tesla is about to deliver self-driving, but you just have to believe him despite the fact that he has been wrong about it every year for the past five years. Yesterday, Tesla unveiled a cool-looking car, the Cybercab, that is entirely reliant on making Full Self-Driving (FSD) work, which was supposed to happen every year for the past 5 years, according to Elon Musk’s own statements.  Every year since 2019, Musk said that he expects Tesla to upgrade its supervised FSD into an unsupervised FSD, as promised, by the end of the year. At one point, the CEO claimed that his inaccurate timelines were due to achieving “local maximums” in the software, which they couldn’t see until they hit those ceilings. Despite this problem, he keeps giving new timelines and selling the product while Tesla could still be running into local maximums. What I wanted from Tesla’s event yesterday was to know what makes this time different. Musk said that Tesla is going to deliver unsupervised self-driving on current vehicles in California and Texas next year. Then, Cybercab will follow when it enters production in 2026 or 2027. But again, why should we believe Musk this time? I was expecting one of two things that Tesla would announce at the event to build more confidence: Tesla did neither. Instead, it’s business as usual with FSD, which currently needs a 500-1000x improvement in miles between interventions.  The latest disengagement data crowdsourced by Tesla owners shows that FSD is currently at about 123 miles between disengagement and the pace of improvement is far from impressive:  Until Tesla shows a clear path toward 100,000+ miles between disengagmeeent, a steering wheel-less robotaxi is pretty meaningless, which explains why Tesla’s stock is down by as much as 10% following the event. Instead of sharing some data about the program, which Tesla certainly has after over 1.6 billion miles on FSD, Musk decided to again only reference direct personal experiences that customers have with Tesla’s Supervised FSD. I am not discounting that Supervised FSD can be impressive, and if it was being developed in a vacuum without Musk giving unreasonable timelines and selling promises to customers for up to $15,000, I think we would all be talking differently about this product. But right now, even though you can have an impressive 100-mile drive without issue on FSD, it doesn’t translate into an unsupervised self-driving system because the data shows it can’t do it reliable thousands of times like a human could. Now, that’s based on my own experience with the system over the last 3 years and the crowdsourced data. To be fair, the crowdsourced data only accounts for ~100,000 miles while Tesla has over 1.6 billion miles of data, but if Tesla refuses to share that data, I have to assume that it doesn’t look much better than the crowdsourced dataset. The Cybercab demos at the event were less impressive than FSD. Tesla chose the Warner Bros studio for a reason.  While these roads look like regular public roads, it’s a private studio set. Tesla doesn’t need to ask California for a self-driving permit to drive there. Tesla has always resisted testing unsupervised self-driving vehicles on California roads, something all other companies developing self-driving technologies are doing. Why? Because it would require them to share their data about disengagement. Therefore, Tesla tuned FSD to work “unsupervised” on these private roads for the event. Also, I put “unsupervised” in quotes because they were unsupervised from inside the vehicle, but it looks like Tesla had staff tracking the demo vehicles and controlling their departures and arrivals. In short, Tesla needs to release its FSD data to show a clear path toward over 100,000 miles between disengagement. Otherwise, this whole thing is pretty meaningless. The Cybercab looks awesome. I love the design. The fact that it only has two seats is a bit annoying, but it’s true that 90% of rideshare rides are for two passengers or fewer. Why does a ""cab"" have only room for two people and scissor doors? How is a low-slung coupe going to help the elderly or people with disabilities who could really use autonomous transport to get somewhere?  Heck, how would it work for my wife and two kids if we needed a ride from, say, the airport to a hotel? We'd have to take two cars. That makes no sense. This thing seems half-baked. For higher volume transit, there’s the new Robovan, but it has the same FSD problem as all other Tesla vehicles.  Optimus looked to have had a meaningful improvement, but it is still ways from being useful and as per many attendees, it seems likely that there was at least a certain level of remote control.  Overall the event was very low in details and new information. It could have been an email. Looks like Tesla wanted to throw a party for its shareholders. The party that Tesla threw for its $TSLA shareholders yesterday cost them ~$50 billion dollar. pic.twitter.com/AzDHEi2uSE A party that cost them about $50 billion in valuation. FTC: We use income earning auto affiliate links. More. Subscribe to Electrek on YouTube for exclusive videos and subscribe to the podcast. Fred is the Editor in Chief and Main Writer at Electrek. You can send tips on Twitter (DMs open) or via email: fred@9to5mac.com Through Zalkon.com, you can check out Fred’s portfolio and get monthly green stock investment ideas. 
										Get interesting investment ideas by Fred Lambert									 
										ChargePoint Home WiFi Enabled Electric Vehicle (EV) Charger									 Manage push notifications",25,2,2
TMZ Staff,"Swae Lee, 2 Chainz Hit Elon Musk's 'We, Robot,' Experience Optimus Robot, Cybercab","Elon Musk unveiled his self-driving vehicles Cybercab and Robovan, in addition to the talking Optimus robot, at his ""We, Robot"" event last night ... leaving two of hip hop's biggest salespeople, Swae Lee and 2 Chainz, floored by humankind's potential future!!!","Elon Musk unveiled his self-driving vehicles Cybercab and Robovan, in addition to the talking Optimus robot, at his ""We, Robot"" event last night ... leaving two of hip hop's biggest salespeople, Swae Lee and 2 Chainz, floored by humankind's potential future!!! The Tesla CEO got all the cheers from Swae when he stepped center stage on the Warner Bros. lot in Burbank .... the Diamond-selling Rae Sremmurd rapper later hopped in the Cybercab, setting the destination to ""New York."" Waiting for your permission to load the Instagram Media. On the ground floor, 2 Chainz had a full-blown conversation with Optimus -- they exchanged names, interest in sports, and the ""Rich as F***"" rapper even promised to BUY HIM once they become available on the market!!! In 2026 or 2027, he'll have the chance to pull off the digital road trip when Elon starts to roll them out. Musk says he's hopeful introducing automated systems will cut down car accidents in America. It'll be interesting if the ride will stream Tyler, The Creator's music, who recently took a swipe at Elon's technological advances at a concert ... but Swae couldn't get enough of the presentation!!! We're sure he has the spare $20-30K to cop an AI ally. Yes! Send me email updates and offers from TMZ and its Affiliates. By subscribing, I agree to the Privacy Policy and Terms of Use",1,1,1
news.google.com,"Stocks making the biggest moves premarket: Wells Fargo, JPMorgan, Tesla, Stellantis and more","Stocks making the biggest moves premarket: Wells Fargo, JPMorgan, Tesla, Stellantis and more CNBC
Tesla, Uber, JPMorgan, Wells Fargo, BlackRock, Fastenal, Affirm, and More Movers Barron's
JPMorgan and Wells Fargo earnings, Tesla stock falls on Cybercab disapp…","
        Stocks making the biggest moves premarket: Wells Fargo, JPMorgan, Tesla, Stellantis and more CNBCTesla, Uber, JPMorgan, Wells Fargo, BlackRock, Fastenal, Affirm, and More Movers Barron'sJPMorgan and Wells Fargo earnings, Tesla stock falls on Cybercab disappointment Yahoo…
    ",3,0,0
Steve Hanley,Thinking Of Getting An Electric Car? Don’t Buy A Tesla!,"Does buying a Tesla today mean you are endorsing the extreme political views of the rabid right wing candidate?
The post Thinking Of Getting An Electric Car? Don’t Buy A Tesla! appeared first on CleanTechnica.",,0,0,0
Tom Ravenscroft,Tesla unveils retro-futuristic art deco Robovan,"Tesla CEO Elon Musk has unveiled the brand's long-awaited driverless Robotaxi as well as surprise prototype Robovan at the We, Robot event in Los Angeles, USA. Musk arrived at the launch event at Warner Bros Studios in the fully autonomous Robotaxi, which he …","Tesla CEO Elon Musk has unveiled the brand's long-awaited driverless Robotaxi as well as surprise prototype Robovan at the We, Robot event in Los Angeles, USA. Musk arrived at the launch event at Warner Bros Studios in the fully autonomous Robotaxi, which he dubbed a ""Cybercab"". However, the star of the show was the surprise reveal of the Robovan prototype. Designed to carry 20 people, the fully autonomous Robovan has a retro-futuristic style. With its sleek form and angled facade, the Robovan has a shape that recalls the streamlined, art deco trains designed in the 1920s and 30s at the end of steam. The van has no visible front or rear windows and features a single slim headlight across its front. This extends to multiple bands that run around the vehicle. According to Musk, much like the recently released Cybertruck, the Robovan was deliberately designed to have a different aesthetic to existing vehicles. ""Now, can you imagine going down the streets and you see this coming towards you? ,"" he said at the event. ""That'd be sick."" ""One of the things we want to do, and we've seen this with the Cybertruck, is we want to change the look of the roads,"" he continued. ""The future should look like the future."" According to Musk, the vehicle is going ""to solve high density"", but could also be used to transport goods. ""So this can carry up to 20 people, and it can also transport goods,"" he said. ""The Robovan is what's going to solve high density."" ""If you want to take a sports team somewhere or you're looking to really get the cost of travel down to, I don't know, 5, 10 cents a mile, then you can use the Robovan."" Before the prototype was unveiled, Musk talked through the Robotaxi. With no steering wheels or pedals, the two-door taxi had minimal features and Cybertruck-esque styling. According to Musk, the car will cost ""below $30,000"" and be on sale in 2026 or 2027. ""We expect to be in production with the Cybercab, which is really highly optimized for autonomous transport in probably, I tend to be a little optimistic with time frames, but in 2026,"" he said. ""So, yeah, before 2027, let me put it that way. And we'll make this vehicle in very high volume."" Last year Tesla released the futuristic-looking Cybertruck. In a Dezeen video, we shared a look inside the electric pickup and looked at its unique features, including the hexagonal steering wheel. A quarterly newsletter rounding up a selection of recently launched products by designers and studios, published on Dezeen Showroom.  Our most popular newsletter, formerly known as Dezeen Weekly, is sent every Tuesday and features a selection of the best reader comments and most talked-about stories. Plus occasional updates on Dezeen’s services and breaking news.  Sent every Thursday and containing a selection of the most important news highlights. Plus occasional updates on Dezeen’s services and invitations to Dezeen events.  A daily newsletter containing the latest stories from Dezeen. Daily updates on the latest design and architecture vacancies advertised on Dezeen Jobs. Plus occasional news. Weekly updates on the latest design and architecture vacancies advertised on Dezeen Jobs. Plus occasional news. News about our Dezeen Awards programme, including entry deadlines and announcements. Plus occasional updates. News from Dezeen Events Guide, a listings guide covering the leading design-related events taking place around the world. Plus occasional updates and invitations to Dezeen events. News about our Dezeen Awards China programme, including entry deadlines and announcements. Plus occasional updates. We will only use your email address to send you the newsletters you have requested. We will never give your details to anyone else without your consent. You can unsubscribe at any time by clicking on the unsubscribe link at the bottom of every email, or by emailing us at [email protected]. For more details, please see our privacy notice.  You will shortly receive a welcome email so please check your inbox. You can unsubscribe at any time by clicking the link at the bottom of every newsletter. Dezeen Agenda features Lotus' tech-heavy concept car Lotus unveils Theory 1 concept car as ""design manifesto"" for ... Bentley's new Continental GT powered by ""an engineering ... ""If it's ludicrously expensive then it must be good"" says ... Why are luxury car brands suddenly building skyscrapers? Roth Architecture creates electric car for navigating narrow ... Gijs Schalkx converts car to run on plastic waste Tesla recalls Cybertrucks after reports of faulty pedals ... Visit our comments page | Read our
comments policy
 Subscribe to our newsletters A quarterly newsletter rounding up a selection of recently launched products by designers and studios, published on Dezeen Showroom.  Our most popular newsletter, formerly known as Dezeen Weekly, is sent every Tuesday and features a selection of the best reader comments and most talked-about stories. Plus occasional updates on Dezeen’s services and breaking news.  Sent every Thursday and containing a selection of the most important news highlights. Plus occasional updates on Dezeen’s services and invitations to Dezeen events.  A daily newsletter containing the latest stories from Dezeen. Daily updates on the latest design and architecture vacancies advertised on Dezeen Jobs. Plus occasional news. Weekly updates on the latest design and architecture vacancies advertised on Dezeen Jobs. Plus occasional news. News about our Dezeen Awards programme, including entry deadlines and announcements. Plus occasional updates. News from Dezeen Events Guide, a listings guide covering the leading design-related events taking place around the world. Plus occasional updates and invitations to Dezeen events. News about our Dezeen Awards China programme, including entry deadlines and announcements. Plus occasional updates. We will only use your email address to send you the newsletters you have requested. We will never give your details to anyone else without your consent. You can unsubscribe at any time by clicking on the unsubscribe link at the bottom of every email, or by emailing us at [email protected]. For more details, please see our privacy notice. You will shortly receive a welcome email so please check your inbox. You can unsubscribe at any time by clicking the link at the bottom of every newsletter.",3,1,8
